{
  "contrato": {
    "nombre": "helpi.evaluacion.sesion",
    "version": "2.0.0"
  },
  "envio": {
    "envioId": "3f2b8c1e-9a47-4d2e-8b61-0c5e7a9d4f12",
    "revision": 1,
    "generadoEn": "2026-10-05T15:20:07Z"
  },
  "sesion": {
    "sesionId": "a7c4e2d9-5b13-4f8a-9e26-1d0b3c8f7a45",
    "estado": "INTERRUMPIDA",
    "creadaEn": "2026-10-05T14:58:31Z",
    "ultimoIntentoEn": "2026-10-05T15:00:12Z",
    "intentosPerdidos": 0
  },
  "participante": {
    "codigo": "P-007"
  },
  "consentimiento": {
    "avisoVersion": "1",
    "otorgadoEn": "2026-10-05T14:52:03Z"
  },
  "condiciones": {
    "entorno": "INTERIOR",
    "tipoEntorno": "AULA",
    "iluminacion": "MEDIA",
    "contraluz": false,
    "distancia": "ENTRE_1_Y_2M",
    "manoDominante": "DIESTRA",
    "guantes": false,
    "soporteCamara": "TRIPODE",
    "perfilParticipante": "SORDA_SENANTE"
  },
  "versiones": {
    "appVersionName": "0.1.0",
    "appVersionCode": 1,
    "modelo": "eva-lsa94-v4",
    "modeloSha256": "751eab8b5cb6642556f227380dd1537154012c9341b8e26d9d593078d0e3a46b",
    "catalogoSha256": "737026d776bd1e8f791b306b14166a9901ca0ebe7fcbd22f1d06d168829c356c",
    "contratoKeypoints": 3,
    "protocolo": "2.0.0"
  },
  "dispositivo": {
    "fabricante": "motorola",
    "modelo": "moto g54 5G",
    "sdkAndroid": 34
  },
  "protocolo": {
    "version": "2.0.0",
    "semilla": "20261005",
    "senas": 94,
    "repeticiones": 5,
    "bloques": 5,
    "intentosPorBloque": 94,
    "secuencia": [
      72,
      75,
      83,
      58,
      72,
      93,
      91,
      46,
      65,
      24,
      12,
      11,
      8,
      36,
      28,
      81,
      61,
      54,
      29,
      77,
      32,
      36,
      15,
      85,
      35,
      86,
      63,
      38,
      52,
      65,
      62,
      6,
      75,
      20,
      31,
      79,
      8,
      25,
      33,
      7,
      71,
      87,
      73,
      14,
      2,
      12,
      56,
      79,
      42,
      8,
      83,
      73,
      4,
      93,
      84,
      28,
      59,
      23,
      25,
      48,
      51,
      17,
      16,
      92,
      16,
      60,
      76,
      33,
      35,
      4,
      51,
      53,
      32,
      43,
      21,
      62,
      15,
      68,
      59,
      92,
      22,
      6,
      90,
      13,
      78,
      38,
      27,
      45,
      58,
      66,
      7,
      40,
      53,
      64,
      65,
      52,
      64,
      70,
      19,
      11,
      39,
      25,
      77,
      49,
      26,
      90,
      26,
      66,
      18,
      25,
      75,
      41,
      68,
      21,
      26,
      9,
      42,
      72,
      49,
      40,
      23,
      46,
      15,
      16,
      80,
      21,
      86,
      89,
      29,
      44,
      74,
      87,
      34,
      93,
      55,
      78,
      33,
      85,
      50,
      32,
      28,
      35,
      89,
      52,
      42,
      44,
      1,
      56,
      88,
      46,
      39,
      92,
      84,
      34,
      48,
      30,
      24,
      76,
      86,
      52,
      57,
      3,
      10,
      28,
      27,
      67,
      91,
      26,
      63,
      59,
      4,
      31,
      82,
      79,
      17,
      37,
      67,
      27,
      41,
      7,
      63,
      40,
      86,
      81,
      57,
      68,
      5,
      69,
      48,
      12,
      54,
      30,
      21,
      5,
      37,
      50,
      38,
      89,
      2,
      81,
      69,
      20,
      64,
      45,
      88,
      2,
      89,
      77,
      89,
      43,
      35,
      23,
      52,
      45,
      28,
      41,
      20,
      30,
      10,
      54,
      75,
      6,
      79,
      14,
      36,
      87,
      18,
      43,
      47,
      12,
      25,
      82,
      17,
      23,
      11,
      64,
      47,
      50,
      51,
      34,
      66,
      8,
      14,
      46,
      19,
      22,
      90,
      33,
      88,
      47,
      31,
      54,
      37,
      86,
      31,
      73,
      43,
      60,
      9,
      10,
      91,
      76,
      56,
      4,
      45,
      7,
      46,
      8,
      22,
      51,
      77,
      19,
      58,
      47,
      53,
      29,
      88,
      39,
      90,
      70,
      87,
      58,
      15,
      74,
      55,
      74,
      81,
      60,
      91,
      14,
      62,
      66,
      87,
      39,
      40,
      80,
      49,
      32,
      60,
      71,
      63,
      67,
      57,
      64,
      77,
      42,
      16,
      4,
      50,
      67,
      49,
      10,
      6,
      1,
      45,
      93,
      47,
      31,
      83,
      0,
      84,
      10,
      48,
      38,
      60,
      67,
      55,
      24,
      3,
      36,
      80,
      53,
      13,
      69,
      74,
      72,
      61,
      69,
      85,
      44,
      62,
      63,
      34,
      1,
      79,
      13,
      37,
      17,
      71,
      39,
      11,
      57,
      49,
      75,
      92,
      83,
      13,
      82,
      76,
      65,
      53,
      19,
      93,
      56,
      83,
      65,
      32,
      29,
      18,
      20,
      61,
      80,
      26,
      15,
      22,
      1,
      19,
      68,
      43,
      41,
      68,
      55,
      41,
      85,
      70,
      44,
      35,
      14,
      0,
      85,
      42,
      91,
      38,
      78,
      11,
      70,
      82,
      74,
      71,
      88,
      51,
      70,
      33,
      0,
      40,
      2,
      72,
      9,
      78,
      30,
      12,
      58,
      80,
      20,
      13,
      59,
      27,
      82,
      44,
      90,
      84,
      92,
      9,
      73,
      76,
      57,
      59,
      3,
      5,
      6,
      37,
      71,
      21,
      18,
      61,
      3,
      17,
      30,
      24,
      81,
      50,
      5,
      69,
      73,
      24,
      62,
      23,
      5,
      55,
      0,
      54,
      16,
      3,
      27,
      36,
      56,
      61,
      2,
      29,
      66,
      9,
      34,
      18,
      0,
      84,
      1,
      48,
      22,
      78,
      7
    ]
  },
  "intentos": [
    {
      "posicion": 1,
      "bloque": 1,
      "numeroIntento": 1,
      "reemplazado": false,
      "senaEsperada": {
        "indice": 72,
        "glosa": "E"
      },
      "vioVideo": false,
      "resultado": "SOBRE_UMBRAL",
      "causaSinResultado": null,
      "prediccion": {
        "indice": 72,
        "glosa": "E",
        "confianza": 0.962134
      },
      "top3": [
        {
          "rango": 1,
          "indice": 72,
          "glosa": "E",
          "confianza": 0.962134
        },
        {
          "rango": 2,
          "indice": 5,
          "glosa": "Celeste",
          "confianza": 0.02187
        },
        {
          "rango": 3,
          "indice": 2,
          "glosa": "Verde",
          "confianza": 0.006411
        }
      ],
      "umbral": 0.9,
      "superoUmbral": true,
      "correcto": true,
      "descartado": false,
      "loHiceMal": false,
      "inicioRelMs": 4210,
      "duracionSegmentoMs": 1630
    },
    {
      "posicion": 2,
      "bloque": 1,
      "numeroIntento": 1,
      "reemplazado": false,
      "senaEsperada": {
        "indice": 75,
        "glosa": "H"
      },
      "vioVideo": false,
      "resultado": "SOBRE_UMBRAL",
      "causaSinResultado": null,
      "prediccion": {
        "indice": 30,
        "glosa": "Desayuno",
        "confianza": 0.917402
      },
      "top3": [
        {
          "rango": 1,
          "indice": 30,
          "glosa": "Desayuno",
          "confianza": 0.917402
        },
        {
          "rango": 2,
          "indice": 75,
          "glosa": "H",
          "confianza": 0.064118
        },
        {
          "rango": 3,
          "indice": 44,
          "glosa": "Asado",
          "confianza": 0.009953
        }
      ],
      "umbral": 0.9,
      "superoUmbral": true,
      "correcto": false,
      "descartado": true,
      "loHiceMal": false,
      "inicioRelMs": 11875,
      "duracionSegmentoMs": 1544
    },
    {
      "posicion": 3,
      "bloque": 1,
      "numeroIntento": 1,
      "reemplazado": false,
      "senaEsperada": {
        "indice": 83,
        "glosa": "P"
      },
      "vioVideo": false,
      "resultado": "BAJO_UMBRAL",
      "causaSinResultado": null,
      "prediccion": {
        "indice": 83,
        "glosa": "P",
        "confianza": 0.613027
      },
      "top3": [
        {
          "rango": 1,
          "indice": 83,
          "glosa": "P",
          "confianza": 0.613027
        },
        {
          "rango": 2,
          "indice": 54,
          "glosa": "Atrapar",
          "confianza": 0.288761
        },
        {
          "rango": 3,
          "indice": 11,
          "glosa": "Hombre",
          "confianza": 0.040335
        }
      ],
      "umbral": 0.9,
      "superoUmbral": false,
      "correcto": false,
      "descartado": false,
      "loHiceMal": true,
      "inicioRelMs": 19340,
      "duracionSegmentoMs": 2011
    },
    {
      "posicion": 4,
      "bloque": 1,
      "numeroIntento": 1,
      "reemplazado": true,
      "senaEsperada": {
        "indice": 58,
        "glosa": "Comprar"
      },
      "vioVideo": false,
      "resultado": "SIN_RESULTADO",
      "causaSinResultado": "SIN_HOMBROS",
      "prediccion": {
        "indice": 5,
        "glosa": "Celeste",
        "confianza": 0.5
      },
      "top3": [],
      "umbral": 0.9,
      "superoUmbral": false,
      "correcto": false,
      "descartado": false,
      "loHiceMal": false,
      "inicioRelMs": 26902,
      "duracionSegmentoMs": null
    },
    {
      "posicion": 4,
      "bloque": 1,
      "numeroIntento": 2,
      "reemplazado": false,
      "senaEsperada": {
        "indice": 58,
        "glosa": "Comprar"
      },
      "vioVideo": true,
      "resultado": "SOBRE_UMBRAL",
      "causaSinResultado": null,
      "prediccion": {